{
  "spec_version": "synthesis-manifest/0.1",
  "name": "qwen3-8b-q4",
  "format": "gguf",
  "path": "~/.autophagy/models/qwen3-8b-q4.gguf",
  "revision": "q4_k_m",
  "digest": "sha256:0000000000000000000000000000000000000000000000000000000000000000",
  "capabilities": ["mutation_synthesis"],
  "resource_hints": {
    "min_memory_mb": 8192,
    "recommended_memory_mb": 16384,
    "context_window_tokens": 32768
  }
}
